{
  "schema_version": "goal-teams-activation-manifest-v2.49",
  "generation_id": "V2.49",
  "generation_state": "active",
  "baseline_generation_id": "V2.48",
  "manifest_payload_sha256": "b8104ff7c216dbba60c449db445a785f18a5102fde2eb2b9eb543040b0371dce",
  "identity": {
    "loaded_runtime_product_version": "V2.49",
    "route_contract_schema_version": "goal-teams-project-route-v2.49",
    "target_policy_generation": "V2.49"
  },
  "root_sets": {
    "bootstrap": [
      {
        "path": ".agents/skills/goal-teams/SKILL.md",
        "sha256": "95a81a428c2412f6e8259cc102aa1985df631e23cba36db332e1c43b2075ca7f",
        "bytes": 471
      },
      {
        "path": "AGENTS.md",
        "sha256": "6321d225054b06c8052c2de5666bcd6c157f77399061abb05d0da6dcb584b271",
        "bytes": 6351
      },
      {
        "path": "RULES.md",
        "sha256": "54eccb6490d87105fe8bfdef19fb41c78d3422af8d23848e3f740c35ca81aea4",
        "bytes": 1281
      },
      {
        "path": "SKILL.md",
        "sha256": "81ca900f386334e7a1ddaeaae66cef2a42cd1275d2cff48ccd4b7992a5dc3e4c",
        "bytes": 6230
      },
      {
        "path": "VERSION",
        "sha256": "1e248e68fc6c9c1667514ff78d0b7600f0169a831214c39ecb77b91a2fb3f82f",
        "bytes": 6
      },
      {
        "path": "agents/openai.yaml",
        "sha256": "e9573309952b223cbbaa3acdd85753592871c0e69aaccc3c80b971f465486948",
        "bytes": 489
      },
      {
        "path": "goal-teams.md",
        "sha256": "de74a55f3c6b77ae7ce9a74dec2ecf14ce2ceb8ddcf2ba16bc6788b0fa72328b",
        "bytes": 4872
      },
      {
        "path": "references/current/generations/V2.49/INDEX.md",
        "sha256": "2e6c949ef1a8338f314533150c1f388339a34d1b1304ae96aa2de5786a02afc2",
        "bytes": 1279
      },
      {
        "path": "scripts/v249/generation_runtime.py",
        "sha256": "2615f280992adedcf16e965152d3c3c8da6616b074b307791976bdc41352a258",
        "bytes": 25931
      },
      {
        "path": "scripts/v249/route_closure.py",
        "sha256": "b08a5e9df46c321a25ca7f284cc8d0305511ea5ee5e262231f13da84fd4ed357",
        "bytes": 7587
      }
    ],
    "current": [
      {
        "path": "references/current/generations/V2.49/core.md",
        "sha256": "779714ad2b5e74ab2ce4f2df63e9f038aa374229d5eb1a57a256f08ca21b2d9e",
        "bytes": 2922
      },
      {
        "path": "references/current/generations/V2.49/routing.md",
        "sha256": "5c49b834a02d2f9fbccc5e141605d919483dd0622fd7156b10268fa10a4cd058",
        "bytes": 2774
      },
      {
        "path": "references/current/generations/V2.49/assurance-levels.md",
        "sha256": "708ed88ed33d0b7e4f7403ecb4d97d71f4a0056bb029483a132929a43e61dc73",
        "bytes": 2200
      },
      {
        "path": "references/current/generations/V2.49/functions/requirements.md",
        "sha256": "822c8db7b0d1a658777f1a90b91042db243abdc90dcbade543299117de2cad99",
        "bytes": 2062
      },
      {
        "path": "references/current/generations/V2.49/functions/architecture-implementation.md",
        "sha256": "bd25444ca1eae06136eb4f0e8e0dee3d7b8113e0de47631f44a564505ff95d02",
        "bytes": 2373
      },
      {
        "path": "references/current/generations/V2.49/functions/testing.md",
        "sha256": "711794ae0fde831913dc8ef74ff35789997e800f3838ea14db6f6af398acf340",
        "bytes": 2920
      },
      {
        "path": "references/current/generations/V2.49/functions/ui-desktop.md",
        "sha256": "5fd4559e9fc9c707360a22357b34debf42204610ffd348c0065c66dabfc51da3",
        "bytes": 2232
      },
      {
        "path": "references/current/generations/V2.49/functions/agent-runtime.md",
        "sha256": "4737d1a523ee33792fcfa7814c43060e6aa570f7760420b3af42808bcc213026",
        "bytes": 2393
      },
      {
        "path": "references/current/generations/V2.49/functions/release-operations.md",
        "sha256": "f9c11579e69dfb41f1c45fdab3900c01154842eda28bbf44d599848113ff29b9",
        "bytes": 3043
      },
      {
        "path": "references/current/generations/V2.49/contracts/task-state.md",
        "sha256": "f55fa312e051e27f8e3912e56448c44ab3adfb15e2f12ca39c1ee00b0611f243",
        "bytes": 2273
      },
      {
        "path": "references/current/generations/V2.49/contracts/test-case-gate.md",
        "sha256": "5b0e32d14c60a4b8816ac986d1777370a8509ba4e7df133f6264eaf4512a466a",
        "bytes": 2393
      },
      {
        "path": "references/current/generations/V2.49/contracts/harness-evidence.md",
        "sha256": "1b6c37633ca50f4f13ac3245aa39312ae03fe4ec3a1f60e32963333cdbf4d2d3",
        "bytes": 2394
      },
      {
        "path": "references/current/generations/V2.49/contracts/review-completion.md",
        "sha256": "1e582f4568b65d873efa0f37080ad65c0ab60bc05a6886d42c53fc3b15e60e88",
        "bytes": 2565
      },
      {
        "path": "references/current/generations/V2.49/contracts/approval-side-effects.md",
        "sha256": "34989fbbf5014d48101946e939f8d2b18461b989481b5c03fb07615b7a9f4a8b",
        "bytes": 2638
      },
      {
        "path": "references/current/generations/V2.49/rule-manifest.json",
        "sha256": "cff057c75f4bca28c5333eaaca7f2b76157b61b64aa872af4dadff0993be8c17",
        "bytes": 11460
      },
      {
        "path": "references/current/generations/V2.49/prompt-manifest.json",
        "sha256": "73ff966222e38eadf7291744c0d7aaac126852804fe33a2177b74458d238d112",
        "bytes": 12268
      },
      {
        "path": "references/okf-conformance-policy.json",
        "sha256": "e2f881c5f1e3e111ef707dda4f30c13b6ae71cdd687cdb2814402fca063d8687",
        "bytes": 5792
      },
      {
        "path": "references/profiles/goal-teams-self-release-v2.49.md",
        "sha256": "ffbc6b6088c01c880afb97534e30d42347c670f0f8748f4fd0a6ef971c8a621e",
        "bytes": 3442
      },
      {
        "path": "references/release-profiles/v2.49.json",
        "sha256": "9a5dbb2944a6eb892300ec2221f34b1291503adb247bebdbea1bc1f1d7e90929",
        "bytes": 1557
      },
      {
        "path": "references/current/generations/V2.49/contracts/public-asset-map.json",
        "sha256": "f33538c0aa66a376c3546920635e261a7d2c51940e895a66b53d21d2120b99be",
        "bytes": 768
      },
      {
        "path": "references/current/generations/V2.49/contracts/release-command-manifest.json",
        "sha256": "ac56a67ef9e142048c2d15572411f47438b66a23cd3e538f6d33c008723ce331",
        "bytes": 3405
      },
      {
        "path": "references/current/generations/V2.49/contracts/release-route-manifest.json",
        "sha256": "4d89465c133db47e8e39e9896432a4b65fe961485a3a3e2105f6d8e0c4ab723f",
        "bytes": 2567
      },
      {
        "path": "references/current/generations/V2.49/contracts/release-security-review-manifest.json",
        "sha256": "83437d9c03c13731fba15262bd5dc23dfbd01c45eacd7fd8e66d0b4a54b2d078",
        "bytes": 12741
      }
    ],
    "execution": [
      {
        "path": "release/current/manifest.json",
        "sha256": "4588f24b2ede630b7929ec82b6d5acf763c0edf6a949f181b9aa83aeef25ef73",
        "bytes": 1588
      },
      {
        "path": "scripts/check.sh",
        "sha256": "d510d27d5780db0c4621138757494c9da6330f33dedae16b5860bc9018d9e666",
        "bytes": 137
      },
      {
        "path": "scripts/checks/check.sh",
        "sha256": "ba12def7c7f4da0339fc8427020a5804973d00a7754e827d76af6c2285253cb3",
        "bytes": 3008
      },
      {
        "path": "scripts/checks/check-okf.py",
        "sha256": "46b40ccc82e601a73470b1bd19e55bb6cb705b51389f8efe77dcf38c1a260b8c",
        "bytes": 6664
      },
      {
        "path": "scripts/checks/check-package-manifest.py",
        "sha256": "1eda3cd56264d49a61b670daad8dace731fb2156e3c400c462be4e31f296225b",
        "bytes": 11769
      },
      {
        "path": "scripts/checks/validate.py",
        "sha256": "639eb339d372f1f759620d07006c771dbdc35d9b77337c8fa39b9ef57e6ef4e4",
        "bytes": 64808
      },
      {
        "path": "scripts/install-local.sh",
        "sha256": "974be151975064d909a922bf7b17cd38ba2a67c8050d1b9173a4901e7807ce30",
        "bytes": 146
      },
      {
        "path": "scripts/install/install-local.sh",
        "sha256": "5d5a32e957d17511cdf0cde913ac9c2d10720c770bacb5cc77d2720beb932737",
        "bytes": 112541
      },
      {
        "path": "scripts/install/package-manifest.txt",
        "sha256": "f5d4434d4ac93189367702bbb70a744be08f940ec86a95ce86ddb7720bde05d6",
        "bytes": 1537
      },
      {
        "path": "scripts/install/replay-package-manifest.txt",
        "sha256": "a12a0f2f23b2ebfe07210c1b9e29d0614a3d9c9851b45799ca29ef43ac474272",
        "bytes": 698
      },
      {
        "path": "scripts/release/build-release.py",
        "sha256": "a8d3b76f86292152741eceb0c1b7c8c94b974adac6ede4774b4f1ed867e7ccba",
        "bytes": 26424
      },
      {
        "path": "scripts/release/release_config.py",
        "sha256": "6a41981f511ae40f9d48c37c7aca6cedde1f194c20855841f008af516d6938e2",
        "bytes": 14559
      },
      {
        "path": "scripts/release/skill_release.py",
        "sha256": "87d293bcf575c91a86677f229f95cf342230b99f6d5175ce5c49f393a971de77",
        "bytes": 76282
      },
      {
        "path": "scripts/release/validate-release.py",
        "sha256": "19f00f550c1093d09ae8f846fe13316ca245e0ca337449f8647c805186c99697",
        "bytes": 37692
      },
      {
        "path": "scripts/checks/check-v249.py",
        "sha256": "8f2b30c51069ef9db189aeb2c03964936e40e61931e5cbf99c81723e2cbe5f1f",
        "bytes": 19029
      },
      {
        "path": "scripts/checks/run-v249-release-security-review.py",
        "sha256": "b32f178d729ca052210e53298bf3f3723aa945326680481be6e0473753ff7219",
        "bytes": 45508
      },
      {
        "path": "scripts/checks/validate-v249-generation.py",
        "sha256": "c2953b782f9653a25ed29f6e16147b279c8a382c8da80f757d6efbc579d96a83",
        "bytes": 5475
      },
      {
        "path": "scripts/checks/validate-v249-test-gate.py",